{
  "document": {
    "schema": "https://agent-workflow.dev/schemas/workflow-definition.json",
    "name": "conformance-host-linear",
    "version": "1.0.0"
  },
  "state_schema": {
    "type": "object",
    "properties": {
      "out": { "type": "string" }
    }
  },
  "nodes": [
    { "id": "start", "type": "start" },
    {
      "id": "work",
      "type": "tool_call",
      "config": { "server": "demo-mcp", "tool": "stub", "arguments": {} }
    },
    { "id": "end", "type": "end", "config": { "output_mapping": ".out" } }
  ],
  "edges": [
    { "source": "__start__", "target": "start" },
    { "source": "start", "target": "work" },
    { "source": "work", "target": "end" }
  ]
}
