{
  "document": {
    "schema": "https://agent-workflow.dev/schemas/workflow-definition.json",
    "name": "r2-parallel-join-n2-of-3",
    "version": "1.0.0"
  },
  "state_schema": {
    "type": "object",
    "properties": {
      "findings": {
        "type": "array",
        "items": { "type": "string" },
        "reducer": "append"
      }
    }
  },
  "nodes": [
    { "id": "start", "type": "start" },
    {
      "id": "fanout",
      "type": "parallel",
      "config": {
        "join": "n_of_m",
        "n": 2,
        "branches": [
          { "name": "a", "entry": "collect_a" },
          { "name": "b", "entry": "collect_b" },
          { "name": "c", "entry": "collect_c" }
        ]
      }
    },
    {
      "id": "collect_a",
      "type": "tool_call",
      "config": { "server": "demo-mcp", "tool": "a", "arguments": {} }
    },
    {
      "id": "collect_b",
      "type": "tool_call",
      "config": { "server": "demo-mcp", "tool": "b", "arguments": {} }
    },
    {
      "id": "collect_c",
      "type": "tool_call",
      "config": { "server": "demo-mcp", "tool": "c", "arguments": {} }
    },
    {
      "id": "rest",
      "type": "wait",
      "config": { "kind": "duration", "duration_ms": 0 }
    },
    {
      "id": "end",
      "type": "end",
      "config": { "output_mapping": ".findings" }
    }
  ],
  "edges": [
    { "source": "__start__", "target": "start" },
    { "source": "start", "target": "fanout" },
    { "source": "fanout", "target": "rest" },
    { "source": "collect_a", "target": "rest" },
    { "source": "collect_b", "target": "rest" },
    { "source": "collect_c", "target": "rest" },
    { "source": "rest", "target": "end" }
  ]
}
